Sheet: Sheet1
A1: 核对项目 | B1: 数量 | C1: 金额 | D1: 材料 | E1: 人工 | F1: 加工 | G1: 制费一 | H1: 制费二 | I1: 制费三 | J1: 制费四 | K1: 制费五
A2: 库存
A3: 库存开账调整 | B3: 0 | C3: 0 | D3: 0 | E3: 0 | F3: 0 | G3: 0 | H3: 0 | I3: 0 | J3: 0 | K3: 0
A4: 库存期初 | B4: 52260442.331986 | C4: 92399709.94 | D4: 74532203.85 | E4: 6710319.23 | F4: 909427.21 | G4: 3687242.38 | H4: 1868859.43 | I4: 1252283.91 | J4: 2036766.55 | K4: 1402607.38
A5: 采购入库 | B5: 31215176.653 | C5: 35530815.74 | D5: 35530815.74 | E5: 0 | F5: 0 | G5: 0 | H5: 0 | I5: 0 | J5: 0 | K5: 0
A6: 委外入库 | B6: 1680029 | C6: 2256341.07 | D6: 1482656.99 | E6: 128688.12 | F6: 320288.48 | G6: 139415.2 | H6: 91239.37 | I6: 29528.01 | J6: 35000.3 | K6: 29524.6 | M6: =R[3]C[-10]+R[11]C[-10] -> -1676315.44
A7: 工单入库 | B7: 10661021 | C7: 49808813.8 | D7: 30933417.35 | E7: 6753716.59 | F7: 523213.17 | G7: 4300784.6 | H7: 2248129.72 | I7: 1453729.12 | J7: 2334368.03 | K7: 1261455.22 | M7: =R[7]C[-10]+R[8]C[-10] -> -43198286.21
A8: 返工入库 | B8: 181934 | C8: 1548265.37 | D8: 894548.72 | E8: 239921.36 | F8: 46121.02 | G8: 131278.46 | H8: 69444.76 | I8: 46040.49 | J8: 46708.82 | K8: 74201.74 | L8: 委外入库+工单入库+返工入库 | M8: =R[-2]C[-10]+R[-1]C[-10]+RC[-10] -> 53613420.24
A9: 杂项入库 | B9: 798185.555 | C9: 1426627.99 | D9: 1187603.44 | E9: 75002.25 | F9: 19817.02 | G9: 39320.67 | H9: 26939.37 | I9: 21570.66 | J9: 34454.76 | K9: 21919.82
A10: 调拨入库 | B10: 0 | C10: 0 | D10: 0 | E10: 0 | F10: 0 | G10: 0 | H10: 0 | I10: 0 | J10: 0 | K10: 0 | M10: =R[8]C[-10]+R[1]C[-10] -> -41315845.11
A11: 销退成本 | B11: 20 | C11: 728 | D11: 702.46 | E11: 13.6 | F11: 0 | G11: 6.8 | H11: 1.56 | I11: 0.52 | J11: 1.21 | K11: 1.85
A12: 当站下线和入库调整 | B12: 0 | C12: 62359.93 | D12: 59398.45 | E12: 0 | F12: 2961.48 | G12: 0 | H12: 0 | I12: 0 | J12: 0 | K12: 0
A13: （小计）： | B13: 44536366.208 | C13: 90633951.9 | D13: 70089143.15 | E13: 7197341.92 | F13: 912401.17 | G13: 4610805.73 | H13: 2435754.78 | I13: 1550868.8 | J13: 2450533.12 | K13: 1387103.23
A14: 返工领出 | B14: -157973.5275 | C14: -1143858.94 | D14: -846407.51 | E14: -102021.29 | F14: -36671.01 | G14: -61054.41 | H14: -30723.05 | I14: -19071.25 | J14: -26785.53 | K14: -21124.89 | M14: =SUM(R[-9]C[-10]:R[-2]C[-10]) -> 90633951.9
A15: 工单发料 | B15: -40440218.364832 | C15: -42054427.27 | D15: -32627685.49 | E15: -2924634.46 | F15: -562959.33 | G15: -2008677.76 | H15: -1276652.84 | I15: -770474.45 | J15: -1206602.73 | K15: -676740.21
A16: （小计）： | B16: -40598191.892332 | C16: -43198286.21 | D16: -33474093 | E16: -3026655.75 | F16: -599630.34 | G16: -2069732.17 | H16: -1307375.89 | I16: -789545.7 | J16: -1233388.26 | K16: -697865.1
A17: 杂项发料 | B17: -1077534.242 | C17: -3102943.43 | D17: -2735561.01 | E17: -111613.43 | F17: -37332.11 | G17: -61899.27 | H17: -40491.05 | I17: -34063.82 | J17: -44925.87 | K17: -37056.87
A18: 销售出货 | B18: -7768837 | C18: -41316573.11 | D18: -31912447.98 | E18: -3636124.32 | F18: -349942.11 | G18: -2065703.54 | H18: -958935.62 | I18: -666448.76 | J18: -1090042.65 | K18: -636928.13
A19: 销售费用 | B19: 0 | C19: 0 | D19: 0 | E19: 0 | F19: 0 | G19: 0 | H19: 0 | I19: 0 | J19: 0 | K19: 0
A20: 盘盈亏 | B20: 0 | C20: 0 | D20: 0 | E20: 0 | F20: 0 | G20: 0 | H20: 0 | I20: 0 | J20: 0 | K20: 0
A21: 调拨出库 | B21: 0 | C21: 0 | D21: 0 | E21: 0 | F21: 0 | G21: 0 | H21: 0 | I21: 0 | J21: 0 | K21: 0
A22: 结存调整 | B22: 0 | C22: -18727.26 | D22: -11610.68 | E22: -2059.13 | F22: -53.78 | G22: -3103.75 | H22: -1461.61 | I22: -490.24 | J22: -607.65 | K22: 659.58
A23: 库存期末 | B23: 47352245.405654 | C23: 95397131.83 | D23: 76487634.33 | E23: 7131208.52 | F23: 834870.04 | G23: 4097609.38 | H23: 1996350.04 | I23: 1312604.19 | J23: 2118335.24 | K23: 1418520.09
A24: 在制下阶
A25: 在制开账调整 | B25: 0 | C25: 0 | D25: 0 | E25: 0 | F25: 0 | G25: 0 | H25: 0 | I25: 0 | J25: 0 | K25: 0
A26: 在制期初 | B26: 4839370.084943 | C26: 6025549.81 | D26: 4661578.55 | E26: 459307.57 | F26: 93547.48 | G26: 240656.59 | H26: 165779.35 | I26: 109641.42 | J26: 182417.55 | K26: 112621.3
A27: 原料投入 | B27: 30112276.892332 | C27: 18559934.51 | D27: 18079382.15 | E27: 137704.14 | F27: 39516.43 | G27: 109064.6 | H27: 71012.28 | I27: 38288.49 | J27: 32375.24 | K27: 52591.18
A28: 半成品投入 | B28: 10489215 | C28: 24638293.57 | D28: 15394710.79 | E28: 2888920.37 | F28: 560113.91 | G28: 1960652.14 | H28: 1236359.79 | I28: 751255.55 | J28: 1201010.52 | K28: 645270.5
A29: 小计（原料+半成品）： | B29: 40601491.892332 | C29: 43198228.08 | D29: 33474092.94 | E29: 3026624.51 | F29: 599630.34 | G29: 2069716.74 | H29: 1307372.07 | I29: 789544.04 | J29: 1233385.76 | K29: 697861.68
A30: 在制人工费 | B30: 12447643.591 | C30: 10690712.1 | D30: 0 | E30: 4106468.84 | F30: 327657.88 | G30: 2536337.93 | H30: 1112492.93 | I30: 750464.59 | J30: 1185372.4 | K30: 671917.53
A31: 在制调整 | B31: 0 | C31: 0 | D31: 0 | E31: 0 | F31: 0 | G31: 0 | H31: 0 | I31: 0 | J31: 0 | K31: 0
A32: 合计： | B32: 53049135.483332 | C32: 53888940.18 | D32: 33474092.94 | E32: 7133093.35 | F32: 927288.22 | G32: 4606054.67 | H32: 2419865 | I32: 1540008.63 | J32: 2418758.16 | K32: 1369779.21
A33: 在制转出 | B33: -52533434.746318 | C33: -53613420.24 | D33: -33310623.06 | E33: -7122326.07 | F33: -889622.67 | G33: -4571478.26 | H33: -2408813.85 | I33: -1529297.62 | J33: -2416077.15 | K33: -1365181.56
A34: 差异转出 | B34: 0 | C34: 0 | D34: 0 | E34: 0 | F34: 0 | G34: 0 | H34: 0 | I34: 0 | J34: 0 | K34: 0
A35: 在制期末 | B35: 5355070.821957 | C35: 6301069.75 | D35: 4825048.43 | E35: 470074.85 | F35: 131213.03 | G35: 275233 | H35: 176830.5 | I35: 120352.43 | J35: 185098.56 | K35: 117218.95
A36: 拆件工单下阶
A37: 拆件期初 | B37: 1200 | C37: 120341.41 | D37: 79907.48 | E37: 16991.67 | F37: 2225.64 | G37: 7637.35 | H37: 3107.99 | I37: 2101.78 | J37: 4747.51 | K37: 3621.99
A38: 拆件投入 | B38: 60 | C38: 410.18 | D38: 348.42 | E38: 32.35 | F38: 0 | G38: 16.16 | H38: 4.41 | I38: 2.28 | J38: 2.88 | K38: 3.68
A39: 拆件人工费 | B39: 0 | C39: 3569.77 | D39: 0 | E39: 1891.47 | F39: 0 | G39: 1056.71 | H39: 214.97 | I39: 105.03 | J39: 172.56 | K39: 129.03
A40: 拆件拆出 | B40: -3360 | C40: -352.05 | D40: -348.36 | E40: -1.11 | F40: 0 | G40: -0.73 | H40: -0.59 | I40: -0.62 | J40: -0.38 | K40: -0.26
A41: 拆件差异 | B41: 3300 | C41: -3627.9 | D41: -0.06 | E41: -1922.71 | F41: 0 | G41: -1072.14 | H41: -218.79 | I41: -106.69 | J41: -175.06 | K41: -132.45
A42: 拆件结存 | B42: 1200 | C42: 120341.41 | D42: 79907.48 | E42: 16991.67 | F42: 2225.64 | G42: 7637.35 | H42: 3107.99 | I42: 2101.78 | J42: 4747.51 | K42: 3621.99